{"meta":{"eventId":"c3a2b1d0-1e2f-4a5b-8c7d-9e0f1a2b3c4d","occurredAt":"2026-10-01T10:05:00Z","producer":"ledger","correlationId":"reconciliation"},"entryId":"e1e2e3e4-0000-4000-8000-000000000001","paymentId":"a0a0a0a0-0000-3000-8000-000000000001","kind":"SALE","postings":[{"account":"seller:0x1111111111111111111111111111111111111111:wallet","side":"DEBIT","amount":{"atomicUnits":20000,"asset":"USDC","decimals":6}},{"account":"seller:0x1111111111111111111111111111111111111111:revenue:data","side":"CREDIT","amount":{"atomicUnits":20000,"asset":"USDC","decimals":6}}],"effectiveAt":"2026-10-01T10:00:00Z"}
